tcpdump -i eth0 port 22
tcpdump: verbose output suppressed, use -v or -vv for full protocol decode
listening on eth0, link-type EN10MB (Ethernet), capture size 262144 bytes
11:56:36.091249 IP cybersecuritydroplet.ssh > 142.126.231.143.52141: Flags [P.], seq 413494970:413495078, ack 1091104077, win 501, options [nop,nop,TS val 1514890950 ecr 3611034878], length 108
11:56:36.091345 IP cybersecuritydroplet.ssh > 142.126.231.143.52141: Flags [P.], seq 108:252, ack 1, win 501, options [nop,nop,TS val 1514890950 ecr 3611034878], length 144
11:56:36.091535 IP cybersecuritydroplet.ssh > 142.126.231.143.52141: Flags [P.], seq 252:288, ack 1, win 501, options [nop,nop,TS val 1514890950 ecr 3611034878], length 36
11:56:36.104403 IP 142.126.231.143.52141 > cybersecuritydroplet.ssh: Flags [.], ack 0, win 5242, options [nop,nop,TS val 3611034896 ecr 1514890944], length 0
11:56:36.105761 IP 142.126.231.143.52141 > cybersecuritydroplet.ssh: Flags [.], ack 108, win 5241, options [nop,nop,TS val 3611034901 ecr 1514890950], length 0
11:56:36.107868 IP 142.126.231.143.52141 > cybersecuritydroplet.ssh: Flags [.], ack 288, win 5240, options [nop,nop,TS val 3611034902 ecr 1514890950], length 0
11:56:36.107868 IP 142.126.231.143.52141 > cybersecuritydroplet.ssh: Flags [P.], seq 1:37, ack 288, win 5243, options [nop,nop,TS val 3611034902 ecr 1514890950], length 36
11:56:36.125590 IP cybersecuritydroplet.ssh > 142.126.231.143.52141: Flags [P.], seq 288:1524, ack 37, win 501, options [nop,nop,TS val 1514890984 ecr 3611034902], length 1236
11:56:36.125905 IP cybersecuritydroplet.ssh > 142.126.231.143.52141: Flags [P.], seq 1524:1736, ack 37, win 501, options [nop,nop,TS val 1514890984 ecr 3611034902], length 212
11:56:36.126014 IP cybersecuritydroplet.ssh > 142.126.231.143.52141: Flags [P.], seq 1736:1948, ack 37, win 501, options [nop,nop,TS val 1514890985 ecr 3611034902], length 212
11:56:36.126129 IP cybersecuritydroplet.ssh > 142.126.231.143.52141: Flags [P.], seq 1948:2160, ack 37, win 501, options [nop,nop,TS val 1514890985 ecr 3611034902], length 212
11:56:36.126261 IP cybersecuritydroplet.ssh > 142.126.231.143.52141: Flags [P.], seq 2160:2372, ack 37, win 501, options [nop,nop,TS val 1514890985 ecr 3611034902], length 212
11:56:36.126381 IP cybersecuritydroplet.ssh > 142.126.231.143.52141: Flags [P.], seq 2372:2584, ack 37, win 501, options [nop,nop,TS val 1514890985 ecr 3611034902], length 212
11:56:36.126506 IP cybersecuritydroplet.ssh > 142.126.231.143.52141: Flags [P.], seq 2584:2796, ack 37, win 501, options [nop,nop,TS val 1514890985 ecr 3611034902], length 212
11:56:36.126623 IP cybersecuritydroplet.ssh > 142.126.231.143.52141: Flags [P.], seq 2796:3008, ack 37, win 501, options [nop,nop,TS val 1514890985 ecr 3611034902], length 212
11:56:36.126735 IP cybersecuritydroplet.ssh > 142.126.231.143.52141: Flags [P.], seq 3008:3220, ack 37, win 501, options [nop,nop,TS val 1514890985 ecr 3611034902], length 212
11:56:36.126923 IP cybersecuritydroplet.ssh > 142.126.231.143.52141: Flags [P.], seq 3220:3432, ack 37, win 501, options [nop,nop,TS val 1514890985 ecr 3611034902], length 212
11:56:36.142533 IP 142.126.231.143.52141 > cybersecuritydroplet.ssh: Flags [.], ack 288, win 5243, options [nop,nop,TS val 3611034937 ecr 1514890950,nop,nop,sack 1 {1524:1948}], length 0
11:56:36.142534 IP 142.126.231.143.52141 > cybersecuritydroplet.ssh: Flags [.], ack 1948, win 5217, options [nop,nop,TS val 3611034937 ecr 1514890984], length 0
11:56:36.142534 IP 142.126.231.143.52141 > cybersecuritydroplet.ssh: Flags [.], ack 2160, win 5239, options [nop,nop,TS val 3611034938 ecr 1514890985], length 0
11:56:36.142534 IP 142.126.231.143.52141 > cybersecuritydroplet.ssh: Flags [.], ack 2160, win 5239, options [nop,nop,TS val 3611034938 ecr 1514890985,nop,nop,sack 1 {2372:2584}], length 0
11:56:36.142605 IP cybersecuritydroplet.ssh > 142.126.231.143.52141: Flags [P.], seq 3432:3644, ack 37, win 501, options [nop,nop,TS val 1514891001 ecr 3611034937], length 212
11:56:36.142831 IP cybersecuritydroplet.ssh > 142.126.231.143.52141: Flags [P.], seq 3644:4560, ack 37, win 501, options [nop,nop,TS val 1514891001 ecr 3611034938], length 916
11:56:36.142992 IP 142.126.231.143.52141 > cybersecuritydroplet.ssh: Flags [.], ack 2584, win 5233, options [nop,nop,TS val 3611034938 ecr 1514890985], length 0
11:56:36.142993 IP 142.126.231.143.52141 > cybersecuritydroplet.ssh: Flags [.], ack 3008, win 5236, options [nop,nop,TS val 3611034938 ecr 1514890985], length 0
11:56:36.142993 IP 142.126.231.143.52141 > cybersecuritydroplet.ssh: Flags [.], ack 3008, win 5236, options [nop,nop,TS val 3611034938 ecr 1514890985,nop,nop,sack 1 {3220:3432}], length 0
11:56:36.142993 IP 142.126.231.143.52141 > cybersecuritydroplet.ssh: Flags [.], ack 3432, win 5236, options [nop,nop,TS val 3611034938 ecr 1514890985], length 0
11:56:36.143010 IP cybersecuritydroplet.ssh > 142.126.231.143.52141: Flags [P.], seq 4560:4808, ack 37, win 501, options [nop,nop,TS val 1514891002 ecr 3611034938], length 248
11:56:36.143095 IP cybersecuritydroplet.ssh > 142.126.231.143.52141: Flags [P.], seq 4808:5236, ack 37, win 501, options [nop,nop,TS val 1514891002 ecr 3611034938], length 428
11:56:36.143200 IP cybersecuritydroplet.ssh > 142.126.231.143.52141: Flags [P.], seq 5236:5732, ack 37, win 501, options [nop,nop,TS val 1514891002 ecr 3611034938], length 496
11:56:36.143425 IP cybersecuritydroplet.ssh > 142.126.231.143.52141: Flags [P.], seq 5732:6228, ack 37, win 501, options [nop,nop,TS val 1514891002 ecr 3611034938], length 496
11:56:36.143554 IP cybersecuritydroplet.ssh > 142.126.231.143.52141: Flags [P.], seq 6228:6724, ack 37, win 501, options [nop,nop,TS val 1514891002 ecr 3611034938], length 496
11:56:36.143707 IP cybersecuritydroplet.ssh > 142.126.231.143.52141: Flags [P.], seq 6724:7008, ack 37, win 501, options [nop,nop,TS val 1514891002 ecr 3611034938], length 284
11:56:36.143850 IP cybersecuritydroplet.ssh > 142.126.231.143.52141: Flags [P.], seq 7008:7220, ack 37, win 501, options [nop,nop,TS val 1514891002 ecr 3611034938], length 212
11:56:36.143908 IP cybersecuritydroplet.ssh > 142.126.231.143.52141: Flags [P.], seq 7220:7468, ack 37, win 501, options [nop,nop,TS val 1514891002 ecr 3611034938], length 248
11:56:36.143967 IP cybersecuritydroplet.ssh > 142.126.231.143.52141: Flags [P.], seq 7468:7716, ack 37, win 501, options [nop,nop,TS val 1514891003 ecr 3611034938], length 248
11:56:36.144063 IP cybersecuritydroplet.ssh > 142.126.231.143.52141: Flags [P.], seq 7716:8000, ack 37, win 501, options [nop,nop,TS val 1514891003 ecr 3611034938], length 284
11:56:36.144155 IP cybersecuritydroplet.ssh > 142.126.231.143.52141: Flags [P.], seq 8000:8248, ack 37, win 501, options [nop,nop,TS val 1514891003 ecr 3611034938], length 248
11:56:36.144253 IP cybersecuritydroplet.ssh > 142.126.231.143.52141: Flags [P.], seq 8248:8496, ack 37, win 501, options [nop,nop,TS val 1514891003 ecr 3611034938], length 248
11:56:36.144347 IP cybersecuritydroplet.ssh > 142.126.231.143.52141: Flags [P.], seq 8496:8744, ack 37, win 501, options [nop,nop,TS val 1514891003 ecr 3611034938], length 248
11:56:36.144427 IP cybersecuritydroplet.ssh > 142.126.231.143.52141: Flags [P.], seq 8744:8956, ack 37, win 501, options [nop,nop,TS val 1514891003 ecr 3611034938], length 212
11:56:36.144504 IP cybersecuritydroplet.ssh > 142.126.231.143.52141: Flags [P.], seq 8956:9204, ack 37, win 501, options [nop,nop,TS val 1514891003 ecr 3611034938], length 248
11:56:36.144583 IP cybersecuritydroplet.ssh > 142.126.231.143.52141: Flags [P.], seq 9204:9452, ack 37, win 501, options [nop,nop,TS val 1514891003 ecr 3611034938], length 248
11:56:36.144672 IP cybersecuritydroplet.ssh > 142.126.231.143.52141: Flags [P.], seq 9452:9736, ack 37, win 501, options [nop,nop,TS val 1514891003 ecr 3611034938], length 284
11:56:36.144761 IP cybersecuritydroplet.ssh > 142.126.231.143.52141: Flags [P.], seq 9736:9984, ack 37, win 501, options [nop,nop,TS val 1514891003 ecr 3611034938], length 248
11:56:36.147454 IP customer-189-217-192-206.cablevision.net.mx.44271 > cybersecuritydroplet.ssh: Flags [.], ack 3427748248, win 229, options [nop,nop,TS val 675075064 ecr 2881586683], length 0
11:56:36.158612 IP 142.126.231.143.52141 > cybersecuritydroplet.ssh: Flags [.], ack 3644, win 5239, options [nop,nop,TS val 3611034953 ecr 1514891001], length 0
11:56:36.158613 IP 142.126.231.143.52141 > cybersecuritydroplet.ssh: Flags [.], ack 3644, win 5239, options [nop,nop,TS val 3611034953 ecr 1514891001,nop,nop,sack 1 {4560:4808}], length 0
11:56:36.158613 IP 142.126.231.143.52141 > cybersecuritydroplet.ssh: Flags [.], ack 4808, win 5221, options [nop,nop,TS val 3611034953 ecr 1514891001], length 0
11:56:36.158683 IP cybersecuritydroplet.ssh > 142.126.231.143.52141: Flags [P.], seq 9984:10496, ack 37, win 501, options [nop,nop,TS val 1514891017 ecr 3611034953], length 512
11:56:36.158906 IP cybersecuritydroplet.ssh > 142.126.231.143.52141: Flags [P.], seq 10496:10692, ack 37, win 501, options [nop,nop,TS val 1514891017 ecr 3611034953], length 196
11:56:36.159002 IP cybersecuritydroplet.ssh > 142.126.231.143.52141: Flags [P.], seq 10692:10956, ack 37, win 501, options [nop,nop,TS val 1514891018 ecr 3611034953], length 264
11:56:36.159094 IP cybersecuritydroplet.ssh > 142.126.231.143.52141: Flags [P.], seq 10956:11224, ack 37, win 501, options [nop,nop,TS val 1514891018 ecr 3611034953], length 268
11:56:36.159194 IP cybersecuritydroplet.ssh > 142.126.231.143.52141: Flags [P.], seq 11224:11684, ack 37, win 501, options [nop,nop,TS val 1514891018 ecr 3611034953], length 460
11:56:36.159234 IP cybersecuritydroplet.ssh > 142.126.231.143.52141: Flags [P.], seq 11684:11720, ack 37, win 501, options [nop,nop,TS val 1514891018 ecr 3611034953], length 36
11:56:36.161581 IP 142.126.231.143.52141 > cybersecuritydroplet.ssh: Flags [.], ack 5732, win 5228, options [nop,nop,TS val 3611034956 ecr 1514891002], length 0
11:56:36.161581 IP 142.126.231.143.52141 > cybersecuritydroplet.ssh: Flags [.], ack 5732, win 5228, options [nop,nop,TS val 3611034956 ecr 1514891002,nop,nop,sack 1 {6724:7220}], length 0
11:56:36.161582 IP 142.126.231.143.52141 > cybersecuritydroplet.ssh: Flags [.], ack 7220, win 5219, options [nop,nop,TS val 3611034956 ecr 1514891002], length 0
11:56:36.161582 IP 142.126.231.143.52141 > cybersecuritydroplet.ssh: Flags [.], ack 7220, win 5243, options [nop,nop,TS val 3611034956 ecr 1514891002,nop,nop,sack 1 {7468:8000}], length 0
11:56:36.161582 IP 142.126.231.143.52141 > cybersecuritydroplet.ssh: Flags [.], ack 8000, win 5230, options [nop,nop,TS val 3611034956 ecr 1514891002], length 0
11:56:36.161582 IP 142.126.231.143.52141 > cybersecuritydroplet.ssh: Flags [.], ack 9204, win 5212, options [nop,nop,TS val 3611034956 ecr 1514891003], length 0
11:56:36.161582 IP 142.126.231.143.52141 > cybersecuritydroplet.ssh: Flags [.], ack 9204, win 5212, options [nop,nop,TS val 3611034956 ecr 1514891003,nop,nop,sack 1 {9736:9984}], length 0
11:56:36.161582 IP 142.126.231.143.52141 > cybersecuritydroplet.ssh: Flags [.], ack 9984, win 5230, options [nop,nop,TS val 3611034956 ecr 1514891003], length 0
11:56:36.161648 IP cybersecuritydroplet.ssh > 142.126.231.143.52141: Flags [P.], seq 11720:12712, ack 37, win 501, options [nop,nop,TS val 1514891020 ecr 3611034956], length 992
11:56:36.162082 IP cybersecuritydroplet.ssh > 142.126.231.143.52141: Flags [P.], seq 12712:13900, ack 37, win 501, options [nop,nop,TS val 1514891021 ecr 3611034956], length 1188
11:56:36.162758 IP cybersecuritydroplet.ssh > 142.126.231.143.52141: Flags [P.], seq 13900:15160, ack 37, win 501, options [nop,nop,TS val 1514891021 ecr 3611034956], length 1260
11:56:36.162909 IP cybersecuritydroplet.ssh > 142.126.231.143.52141: Flags [P.], seq 15160:15408, ack 37, win 501, options [nop,nop,TS val 1514891021 ecr 3611034956], length 248
11:56:36.163063 IP cybersecuritydroplet.ssh > 142.126.231.143.52141: Flags [P.], seq 15408:15656, ack 37, win 501, options [nop,nop,TS val 1514891022 ecr 3611034956], length 248
11:56:36.163195 IP cybersecuritydroplet.ssh > 142.126.231.143.52141: Flags [P.], seq 15656:15904, ack 37, win 501, options [nop,nop,TS val 1514891022 ecr 3611034956], length 248
11:56:36.163527 IP cybersecuritydroplet.ssh > 142.126.231.143.52141: Flags [P.], seq 15904:16152, ack 37, win 501, options [nop,nop,TS val 1514891022 ecr 3611034956], length 248
11:56:36.163875 IP cybersecuritydroplet.ssh > 142.126.231.143.52141: Flags [P.], seq 16152:16400, ack 37, win 501, options [nop,nop,TS val 1514891022 ecr 3611034956], length 248
11:56:36.164017 IP cybersecuritydroplet.ssh > 142.126.231.143.52141: Flags [P.], seq 16400:16648, ack 37, win 501, options [nop,nop,TS val 1514891023 ecr 3611034956], length 248
11:56:36.164141 IP cybersecuritydroplet.ssh > 142.126.231.143.52141: Flags [P.], seq 16648:16896, ack 37, win 501, options [nop,nop,TS val 1514891023 ecr 3611034956], length 248
11:56:36.164263 IP cybersecuritydroplet.ssh > 142.126.231.143.52141: Flags [P.], seq 16896:17144, ack 37, win 501, options [nop,nop,TS val 1514891023 ecr 3611034956], length 248
11:56:36.164454 IP cybersecuritydroplet.ssh > 142.126.231.143.52141: Flags [P.], seq 17144:17392, ack 37, win 501, options [nop,nop,TS val 1514891023 ecr 3611034956], length 248
11:56:36.164593 IP cybersecuritydroplet.ssh > 142.126.231.143.52141: Flags [P.], seq 17392:17640, ack 37, win 501, options [nop,nop,TS val 1514891023 ecr 3611034956], length 248
11:56:36.164786 IP cybersecuritydroplet.ssh > 142.126.231.143.52141: Flags [P.], seq 17640:17888, ack 37, win 501, options [nop,nop,TS val 1514891023 ecr 3611034956], length 248
11:56:36.164914 IP cybersecuritydroplet.ssh > 142.126.231.143.52141: Flags [P.], seq 17888:18136, ack 37, win 501, options [nop,nop,TS val 1514891023 ecr 3611034956], length 248
11:56:36.165038 IP cybersecuritydroplet.ssh > 142.126.231.143.52141: Flags [P.], seq 18136:18384, ack 37, win 501, options [nop,nop,TS val 1514891024 ecr 3611034956], length 248
11:56:36.165208 IP cybersecuritydroplet.ssh > 142.126.231.143.52141: Flags [P.], seq 18384:18632, ack 37, win 501, options [nop,nop,TS val 1514891024 ecr 3611034956], length 248
11:56:36.165339 IP cybersecuritydroplet.ssh > 142.126.231.143.52141: Flags [P.], seq 18632:18880, ack 37, win 501, options [nop,nop,TS val 1514891024 ecr 3611034956], length 248
11:56:36.165676 IP cybersecuritydroplet.ssh > 142.126.231.143.52141: Flags [P.], seq 18880:19128, ack 37, win 501, options [nop,nop,TS val 1514891024 ecr 3611034956], length 248
11:56:36.165969 IP cybersecuritydroplet.ssh > 142.126.231.143.52141: Flags [P.], seq 19128:19340, ack 37, win 501, options [nop,nop,TS val 1514891025 ecr 3611034956], length 212
11:56:36.166042 IP cybersecuritydroplet.ssh > 142.126.231.143.52141: Flags [P.], seq 19340:19588, ack 37, win 501, options [nop,nop,TS val 1514891025 ecr 3611034956], length 248
11:56:36.166147 IP cybersecuritydroplet.ssh > 142.126.231.143.52141: Flags [P.], seq 19588:19872, ack 37, win 501, options [nop,nop,TS val 1514891025 ecr 3611034956], length 284
11:56:36.166245 IP cybersecuritydroplet.ssh > 142.126.231.143.52141: Flags [P.], seq 19872:20120, ack 37, win 501, options [nop,nop,TS val 1514891025 ecr 3611034956], length 248
11:56:36.166327 IP cybersecuritydroplet.ssh > 142.126.231.143.52141: Flags [P.], seq 20120:20368, ack 37, win 501, options [nop,nop,TS val 1514891025 ecr 3611034956], length 248
11:56:36.166436 IP cybersecuritydroplet.ssh > 142.126.231.143.52141: Flags [P.], seq 20368:20616, ack 37, win 501, options [nop,nop,TS val 1514891025 ecr 3611034956], length 248
11:56:36.166540 IP cybersecuritydroplet.ssh > 142.126.231.143.52141: Flags [P.], seq 20616:20864, ack 37, win 501, options [nop,nop,TS val 1514891025 ecr 3611034956], length 248
11:56:36.166652 IP cybersecuritydroplet.ssh > 142.126.231.143.52141: Flags [P.], seq 20864:21112, ack 37, win 501, options [nop,nop,TS val 1514891025 ecr 3611034956], length 248
11:56:36.166740 IP cybersecuritydroplet.ssh > 142.126.231.143.52141: Flags [P.], seq 21112:21360, ack 37, win 501, options [nop,nop,TS val 1514891025 ecr 3611034956], length 248
11:56:36.166835 IP cybersecuritydroplet.ssh > 142.126.231.143.52141: Flags [P.], seq 21360:21608, ack 37, win 501, options [nop,nop,TS val 1514891025 ecr 3611034956], length 248
11:56:36.166930 IP cybersecuritydroplet.ssh > 142.126.231.143.52141: Flags [P.], seq 21608:21856, ack 37, win 501, options [nop,nop,TS val 1514891025 ecr 3611034956], length 248
11:56:36.167132 IP cybersecuritydroplet.ssh > 142.126.231.143.52141: Flags [P.], seq 21856:22068, ack 37, win 501, options [nop,nop,TS val 1514891026 ecr 3611034956], length 212
11:56:36.167237 IP cybersecuritydroplet.ssh > 142.126.231.143.52141: Flags [P.], seq 22068:22316, ack 37, win 501, options [nop,nop,TS val 1514891026 ecr 3611034956], length 248
11:56:36.167471 IP cybersecuritydroplet.ssh > 142.126.231.143.52141: Flags [P.], seq 22316:22600, ack 37, win 501, options [nop,nop,TS val 1514891026 ecr 3611034956], length 284
11:56:36.167631 IP cybersecuritydroplet.ssh > 142.126.231.143.52141: Flags [P.], seq 22600:22848, ack 37, win 501, options [nop,nop,TS val 1514891026 ecr 3611034956], length 248
11:56:36.175691 IP 142.126.231.143.52141 > cybersecuritydroplet.ssh: Flags [.], ack 10496, win 5235, options [nop,nop,TS val 3611034969 ecr 1514891017], length 0
11:56:36.175692 IP 142.126.231.143.52141 > cybersecuritydroplet.ssh: Flags [.], ack 10496, win 5235, options [nop,nop,TS val 3611034969 ecr 1514891017,nop,nop,sack 1 {10692:10956}], length 0
11:56:36.175692 IP 142.126.231.143.52141 > cybersecuritydroplet.ssh: Flags [.], ack 10956, win 5235, options [nop,nop,TS val 3611034969 ecr 1514891017], length 0
11:56:36.175692 IP 142.126.231.143.52141 > cybersecuritydroplet.ssh: Flags [.], ack 11684, win 5231, options [nop,nop,TS val 3611034969 ecr 1514891018], length 0
11:56:36.175692 IP 142.126.231.143.52141 > cybersecuritydroplet.ssh: Flags [.], ack 11720, win 5242, options [nop,nop,TS val 3611034969 ecr 1514891018], length 0
11:56:36.175768 IP cybersecuritydroplet.ssh > 142.126.231.143.52141: Flags [P.], seq 22848:23096, ack 37, win 501, options [nop,nop,TS val 1514891034 ecr 3611034969], length 248
11:56:36.175979 IP cybersecuritydroplet.ssh > 142.126.231.143.52141: Flags [P.], seq 23096:23292, ack 37, win 501, options [nop,nop,TS val 1514891035 ecr 3611034969], length 196
11:56:36.176064 IP cybersecuritydroplet.ssh > 142.126.231.143.52141: Flags [P.], seq 23292:23556, ack 37, win 501, options [nop,nop,TS val 1514891035 ecr 3611034969], length 264
11:56:36.176126 IP cybersecuritydroplet.ssh > 142.126.231.143.52141: Flags [P.], seq 23556:23592, ack 37, win 501, options [nop,nop,TS val 1514891035 ecr 3611034969], length 36
11:56:36.176220 IP cybersecuritydroplet.ssh > 142.126.231.143.52141: Flags [P.], seq 23592:24020, ack 37, win 501, options [nop,nop,TS val 1514891035 ecr 3611034969], length 428
11:56:36.176322 IP cybersecuritydroplet.ssh > 142.126.231.143.52141: Flags [P.], seq 24020:24288, ack 37, win 501, options [nop,nop,TS val 1514891035 ecr 3611034969], length 268
11:56:36.176419 IP cybersecuritydroplet.ssh > 142.126.231.143.52141: Flags [P.], seq 24288:24784, ack 37, win 501, options [nop,nop,TS val 1514891035 ecr 3611034969], length 496
11:56:36.176430 IP 142.126.231.143.52141 > cybersecuritydroplet.ssh: Flags [.], ack 13900, win 5208, options [nop,nop,TS val 3611034972 ecr 1514891021], length 0
11:56:36.176504 IP cybersecuritydroplet.ssh > 142.126.231.143.52141: Flags [P.], seq 24784:24996, ack 37, win 501, options [nop,nop,TS val 1514891035 ecr 3611034972], length 212
11:56:36.176596 IP cybersecuritydroplet.ssh > 142.126.231.143.52141: Flags [P.], seq 24996:25280, ack 37, win 501, options [nop,nop,TS val 1514891035 ecr 3611034972], length 284
11:56:36.176673 IP cybersecuritydroplet.ssh > 142.126.231.143.52141: Flags [P.], seq 25280:25528, ack 37, win 501, options [nop,nop,TS val 1514891035 ecr 3611034972], length 248
11:56:36.176761 IP cybersecuritydroplet.ssh > 142.126.231.143.52141: Flags [P.], seq 25528:25988, ack 37, win 501, options [nop,nop,TS val 1514891035 ecr 3611034972], length 460
11:56:36.176844 IP cybersecuritydroplet.ssh > 142.126.231.143.52141: Flags [P.], seq 25988:26256, ack 37, win 501, options [nop,nop,TS val 1514891035 ecr 3611034972], length 268
11:56:36.176928 IP cybersecuritydroplet.ssh > 142.126.231.143.52141: Flags [P.], seq 26256:26504, ack 37, win 501, options [nop,nop,TS val 1514891035 ecr 3611034972], length 248
11:56:36.177014 IP cybersecuritydroplet.ssh > 142.126.231.143.52141: Flags [P.], seq 26504:26964, ack 37, win 501, options [nop,nop,TS val 1514891036 ecr 3611034972], length 460
11:56:36.177097 IP cybersecuritydroplet.ssh > 142.126.231.143.52141: Flags [P.], seq 26964:27212, ack 37, win 501, options [nop,nop,TS val 1514891036 ecr 3611034972], length 248
11:56:36.177181 IP cybersecuritydroplet.ssh > 142.126.231.143.52141: Flags [P.], seq 27212:27460, ack 37, win 501, options [nop,nop,TS val 1514891036 ecr 3611034972], length 248
11:56:36.177536 IP 142.126.231.143.52141 > cybersecuritydroplet.ssh: Flags [.], ack 13900, win 5243, options [nop,nop,TS val 3611034972 ecr 1514891021,nop,nop,sack 1 {15160:15656}], length 0
11:56:36.177536 IP 142.126.231.143.52141 > cybersecuritydroplet.ssh: Flags [.], ack 15656, win 5215, options [nop,nop,TS val 3611034972 ecr 1514891021], length 0
11:56:36.177537 IP 142.126.231.143.52141 > cybersecuritydroplet.ssh: Flags [.], ack 15656, win 5243, options [nop,nop,TS val 3611034973 ecr 1514891021,nop,nop,sack 1 {15904:16152}], length 0
11:56:36.177537 IP 142.126.231.143.52141 > cybersecuritydroplet.ssh: Flags [.], ack 16152, win 5235, options [nop,nop,TS val 3611034973 ecr 1514891022], length 0
11:56:36.177580 IP cybersecuritydroplet.ssh > 142.126.231.143.52141: Flags [P.], seq 27460:28488, ack 37, win 501, options [nop,nop,TS val 1514891036 ecr 3611034972], length 1028
11:56:36.177714 IP cybersecuritydroplet.ssh > 142.126.231.143.52141: Flags [P.], seq 28488:28716, ack 37, win 501, options [nop,nop,TS val 1514891036 ecr 3611034973], length 228
11:56:36.177786 IP cybersecuritydroplet.ssh > 142.126.231.143.52141: Flags [P.], seq 28716:28948, ack 37, win 501, options [nop,nop,TS val 1514891036 ecr 3611034973], length 232
11:56:36.177839 IP cybersecuritydroplet.ssh > 142.126.231.143.52141: Flags [P.], seq 28948:28984, ack 37, win 501, options [nop,nop,TS val 1514891036 ecr 3611034973], length 36
11:56:36.177931 IP cybersecuritydroplet.ssh > 142.126.231.143.52141: Flags [P.], seq 28984:29444, ack 37, win 501, options [nop,nop,TS val 1514891036 ecr 3611034973], length 460
11:56:36.178009 IP cybersecuritydroplet.ssh > 142.126.231.143.52141: Flags [P.], seq 29444:29728, ack 37, win 501, options [nop,nop,TS val 1514891037 ecr 3611034973], length 284
11:56:36.178083 IP cybersecuritydroplet.ssh > 142.126.231.143.52141: Flags [P.], seq 29728:29976, ack 37, win 501, options [nop,nop,TS val 1514891037 ecr 3611034973], length 248
11:56:36.178157 IP cybersecuritydroplet.ssh > 142.126.231.143.52141: Flags [P.], seq 29976:30436, ack 37, win 501, options [nop,nop,TS val 1514891037 ecr 3611034973], length 460
11:56:36.178236 IP cybersecuritydroplet.ssh > 142.126.231.143.52141: Flags [P.], seq 30436:30684, ack 37, win 501, options [nop,nop,TS val 1514891037 ecr 3611034973], length 248
11:56:36.178342 IP cybersecuritydroplet.ssh > 142.126.231.143.52141: Flags [P.], seq 30684:30968, ack 37, win 501, options [nop,nop,TS val 1514891037 ecr 3611034973], length 284
11:56:36.180844 IP 142.126.231.143.52141 > cybersecuritydroplet.ssh: Flags [.], ack 16152, win 5243, options [nop,nop,TS val 3611034975 ecr 1514891022,nop,nop,sack 1 {16400:16648}], length 0
11:56:36.180845 IP 142.126.231.143.52141 > cybersecuritydroplet.ssh: Flags [.], ack 16648, win 5235, options [nop,nop,TS val 3611034975 ecr 1514891022,nop,nop,sack 1 {16896:17144}], length 0
11:56:36.180845 IP 142.126.231.143.52141 > cybersecuritydroplet.ssh: Flags [.], ack 17144, win 5227, options [nop,nop,TS val 3611034975 ecr 1514891023], length 0
11:56:36.180845 IP 142.126.231.143.52141 > cybersecuritydroplet.ssh: Flags [.], ack 17144, win 5243, options [nop,nop,TS val 3611034975 ecr 1514891023,nop,nop,sack 1 {17392:17640}], length 0
11:56:36.180845 IP 142.126.231.143.52141 > cybersecuritydroplet.ssh: Flags [.], ack 17144, win 5243, options [nop,nop,TS val 3611034975 ecr 1514891023,nop,nop,sack 2 {17888:18136}{17392:17640}], length 0
11:56:36.180845 IP 142.126.231.143.52141 > cybersecuritydroplet.ssh: Flags [.], ack 17640, win 5235, options [nop,nop,TS val 3611034975 ecr 1514891023,nop,nop,sack 1 {17888:18136}], length 0
11:56:36.180845 IP 142.126.231.143.52141 > cybersecuritydroplet.ssh: Flags [.], ack 18136, win 5227, options [nop,nop,TS val 3611034975 ecr 1514891023], length 0
11:56:36.180845 IP 142.126.231.143.52141 > cybersecuritydroplet.ssh: Flags [.], ack 18880, win 5231, options [nop,nop,TS val 3611034975 ecr 1514891024], length 0
11:56:36.180911 IP cybersecuritydroplet.ssh > 142.126.231.143.52141: Flags [P.], seq 30968:31960, ack 37, win 501, options [nop,nop,TS val 1514891039 ecr 3611034975], length 992
11:56:36.181101 IP cybersecuritydroplet.ssh > 142.126.231.143.52141: Flags [P.], seq 31960:32188, ack 37, win 501, options [nop,nop,TS val 1514891040 ecr 3611034975], length 228
11:56:36.181199 IP cybersecuritydroplet.ssh > 142.126.231.143.52141: Flags [P.], seq 32188:32452, ack 37, win 501, options [nop,nop,TS val 1514891040 ecr 3611034975], length 264
11:56:36.181284 IP cybersecuritydroplet.ssh > 142.126.231.143.52141: Flags [P.], seq 32452:32720, ack 37, win 501, options [nop,nop,TS val 1514891040 ecr 3611034975], length 268
11:56:36.181382 IP cybersecuritydroplet.ssh > 142.126.231.143.52141: Flags [P.], seq 32720:33228, ack 37, win 501, options [nop,nop,TS val 1514891040 ecr 3611034975], length 508
11:56:36.181420 IP cybersecuritydroplet.ssh > 142.126.231.143.52141: Flags [P.], seq 33228:33264, ack 37, win 501, options [nop,nop,TS val 1514891040 ecr 3611034975], length 36
11:56:36.181518 IP cybersecuritydroplet.ssh > 142.126.231.143.52141: Flags [P.], seq 33264:33724, ack 37, win 501, options [nop,nop,TS val 1514891040 ecr 3611034975], length 460
11:56:36.181629 IP cybersecuritydroplet.ssh > 142.126.231.143.52141: Flags [P.], seq 33724:34204, ack 37, win 501, options [nop,nop,TS val 1514891040 ecr 3611034975], length 480
11:56:36.181725 IP cybersecuritydroplet.ssh > 142.126.231.143.52141: Flags [P.], seq 34204:34488, ack 37, win 501, options [nop,nop,TS val 1514891040 ecr 3611034975], length 284
11:56:36.181820 IP cybersecuritydroplet.ssh > 142.126.231.143.52141: Flags [P.], seq 34488:34984, ack 37, win 501, options [nop,nop,TS val 1514891040 ecr 3611034975], length 496
11:56:36.181969 IP cybersecuritydroplet.ssh > 142.126.231.143.52141: Flags [P.], seq 34984:35444, ack 37, win 501, options [nop,nop,TS val 1514891041 ecr 3611034975], length 460
11:56:36.182014 IP cybersecuritydroplet.ssh > 142.126.231.143.52141: Flags [P.], seq 35444:35480, ack 37, win 501, options [nop,nop,TS val 1514891041 ecr 3611034975], length 36
11:56:36.182107 IP cybersecuritydroplet.ssh > 142.126.231.143.52141: Flags [P.], seq 35480:35940, ack 37, win 501, options [nop,nop,TS val 1514891041 ecr 3611034975], length 460
11:56:36.182204 IP cybersecuritydroplet.ssh > 142.126.231.143.52141: Flags [P.], seq 35940:36436, ack 37, win 501, options [nop,nop,TS val 1514891041 ecr 3611034975], length 496
11:56:36.182300 IP cybersecuritydroplet.ssh > 142.126.231.143.52141: Flags [P.], seq 36436:36720, ack 37, win 501, options [nop,nop,TS val 1514891041 ecr 3611034975], length 284
11:56:36.182406 IP cybersecuritydroplet.ssh > 142.126.231.143.52141: Flags [P.], seq 36720:37216, ack 37, win 501, options [nop,nop,TS val 1514891041 ecr 3611034975], length 496
11:56:36.182500 IP cybersecuritydroplet.ssh > 142.126.231.143.52141: Flags [P.], seq 37216:37712, ack 37, win 501, options [nop,nop,TS val 1514891041 ecr 3611034975], length 496
11:56:36.182594 IP cybersecuritydroplet.ssh > 142.126.231.143.52141: Flags [P.], seq 37712:38172, ack 37, win 501, options [nop,nop,TS val 1514891041 ecr 3611034975], length 460
11:56:36.182698 IP cybersecuritydroplet.ssh > 142.126.231.143.52141: Flags [P.], seq 38172:38456, ack 37, win 501, options [nop,nop,TS val 1514891041 ecr 3611034975], length 284
11:56:36.182719 IP 142.126.231.143.52141 > cybersecuritydroplet.ssh: Flags [.], ack 18880, win 5243, options [nop,nop,TS val 3611034977 ecr 1514891024,nop,nop,sack 1 {19128:19340}], length 0
11:56:36.182719 IP 142.126.231.143.52141 > cybersecuritydroplet.ssh: Flags [.], ack 18880, win 5243, options [nop,nop,TS val 3611034977 ecr 1514891024,nop,nop,sack 2 {19588:20120}{19128:19340}], length 0
11:56:36.182719 IP 142.126.231.143.52141 > cybersecuritydroplet.ssh: Flags [.], ack 19340, win 5235, options [nop,nop,TS val 3611034977 ecr 1514891024,nop,nop,sack 1 {19588:20120}], length 0
11:56:36.182719 IP 142.126.231.143.52141 > cybersecuritydroplet.ssh: Flags [.], ack 20120, win 5223, options [nop,nop,TS val 3611034977 ecr 1514891025], length 0
11:56:36.182719 IP 142.126.231.143.52141 > cybersecuritydroplet.ssh: Flags [.], ack 20120, win 5243, options [nop,nop,TS val 3611034977 ecr 1514891025,nop,nop,sack 1 {20368:20864}], length 0
11:56:36.182799 IP cybersecuritydroplet.ssh > 142.126.231.143.52141: Flags [P.], seq 38456:38668, ack 37, win 501, options [nop,nop,TS val 1514891041 ecr 3611034977], length 212
11:56:36.182915 IP 142.126.231.143.52141 > cybersecuritydroplet.ssh: Flags [.], ack 20864, win 5231, options [nop,nop,TS val 3611034977 ecr 1514891025], length 0
11:56:36.182915 IP 142.126.231.143.52141 > cybersecuritydroplet.ssh: Flags [.], ack 21608, win 5219, options [nop,nop,TS val 3611034977 ecr 1514891025], length 0
11:56:36.182925 IP cybersecuritydroplet.ssh > 142.126.231.143.52141: Flags [P.], seq 38668:38968, ack 37, win 501, options [nop,nop,TS val 1514891041 ecr 3611034977], length 300
11:56:36.182994 IP cybersecuritydroplet.ssh > 142.126.231.143.52141: Flags [P.], seq 38968:39248, ack 37, win 501, options [nop,nop,TS val 1514891042 ecr 3611034977], length 280
11:56:36.183090 IP cybersecuritydroplet.ssh > 142.126.231.143.52141: Flags [P.], seq 39248:39744, ack 37, win 501, options [nop,nop,TS val 1514891042 ecr 3611034977], length 496
11:56:36.183186 IP cybersecuritydroplet.ssh > 142.126.231.143.52141: Flags [P.], seq 39744:40220, ack 37, win 501, options [nop,nop,TS val 1514891042 ecr 3611034977], length 476
11:56:36.183286 IP cybersecuritydroplet.ssh > 142.126.231.143.52141: Flags [P.], seq 40220:40684, ack 37, win 501, options [nop,nop,TS val 1514891042 ecr 3611034977], length 464
11:56:36.183500 IP cybersecuritydroplet.ssh > 142.126.231.143.52141: Flags [P.], seq 40684:40968, ack 37, win 501, options [nop,nop,TS val 1514891042 ecr 3611034977], length 284
11:56:36.183852 IP cybersecuritydroplet.ssh > 142.126.231.143.52141: Flags [P.], seq 40968:42208, ack 37, win 501, options [nop,nop,TS val 1514891042 ecr 3611034977], length 1240
11:56:36.183883 IP 142.126.231.143.52141 > cybersecuritydroplet.ssh: Flags [.], ack 21856, win 5239, options [nop,nop,TS val 3611034978 ecr 1514891025], length 0
11:56:36.183883 IP 142.126.231.143.52141 > cybersecuritydroplet.ssh: Flags [.], ack 21856, win 5239, options [nop,nop,TS val 3611034978 ecr 1514891025,nop,nop,sack 1 {22316:22600}], length 0
11:56:36.183884 IP 142.126.231.143.52141 > cybersecuritydroplet.ssh: Flags [.], ack 22600, win 5227, options [nop,nop,TS val 3611034978 ecr 1514891026], length 0
11:56:36.183884 IP 142.126.231.143.52141 > cybersecuritydroplet.ssh: Flags [.], ack 22848, win 5239, options [nop,nop,TS val 3611034978 ecr 1514891026], length 0
11:56:36.184452 IP cybersecuritydroplet.ssh > 142.126.231.143.52141: Flags [P.], seq 42208:43416, ack 37, win 501, options [nop,nop,TS val 1514891043 ecr 3611034978], length 1208
11:56:36.184643 IP cybersecuritydroplet.ssh > 142.126.231.143.52141: Flags [P.], seq 43416:43664, ack 37, win 501, options [nop,nop,TS val 1514891043 ecr 3611034978], length 248
11:56:36.184774 IP cybersecuritydroplet.ssh > 142.126.231.143.52141: Flags [P.], seq 43664:43912, ack 37, win 501, options [nop,nop,TS val 1514891043 ecr 3611034978], length 248
11:56:36.184898 IP cybersecuritydroplet.ssh > 142.126.231.143.52141: Flags [P.], seq 43912:44160, ack 37, win 501, options [nop,nop,TS val 1514891043 ecr 3611034978], length 248
11:56:36.185220 IP cybersecuritydroplet.ssh > 142.126.231.143.52141: Flags [P.], seq 44160:44372, ack 37, win 501, options [nop,nop,TS val 1514891044 ecr 3611034978], length 212
11:56:36.185297 IP cybersecuritydroplet.ssh > 142.126.231.143.52141: Flags [P.], seq 44372:44620, ack 37, win 501, options [nop,nop,TS val 1514891044 ecr 3611034978], length 248
11:56:36.185405 IP cybersecuritydroplet.ssh > 142.126.231.143.52141: Flags [P.], seq 44620:44904, ack 37, win 501, options [nop,nop,TS val 1514891044 ecr 3611034978], length 284
11:56:36.185505 IP cybersecuritydroplet.ssh > 142.126.231.143.52141: Flags [P.], seq 44904:45152, ack 37, win 501, options [nop,nop,TS val 1514891044 ecr 3611034978], length 248
11:56:36.185608 IP cybersecuritydroplet.ssh > 142.126.231.143.52141: Flags [P.], seq 45152:45400, ack 37, win 501, options [nop,nop,TS val 1514891044 ecr 3611034978], length 248
11:56:36.185702 IP cybersecuritydroplet.ssh > 142.126.231.143.52141: Flags [P.], seq 45400:45648, ack 37, win 501, options [nop,nop,TS val 1514891044 ecr 3611034978], length 248
11:56:36.185794 IP cybersecuritydroplet.ssh > 142.126.231.143.52141: Flags [P.], seq 45648:45896, ack 37, win 501, options [nop,nop,TS val 1514891044 ecr 3611034978], length 248
11:56:36.185882 IP cybersecuritydroplet.ssh > 142.126.231.143.52141: Flags [P.], seq 45896:46144, ack 37, win 501, options [nop,nop,TS val 1514891044 ecr 3611034978], length 248
11:56:36.185971 IP cybersecuritydroplet.ssh > 142.126.231.143.52141: Flags [P.], seq 46144:46364, ack 37, win 501, options [nop,nop,TS val 1514891045 ecr 3611034978], length 220
11:56:36.186060 IP cybersecuritydroplet.ssh > 142.126.231.143.52141: Flags [P.], seq 46364:46584, ack 37, win 501, options [nop,nop,TS val 1514891045 ecr 3611034978], length 220
11:56:36.186150 IP cybersecuritydroplet.ssh > 142.126.231.143.52141: Flags [P.], seq 46584:46832, ack 37, win 501, options [nop,nop,TS val 1514891045 ecr 3611034978], length 248
11:56:36.186238 IP cybersecuritydroplet.ssh > 142.126.231.143.52141: Flags [P.], seq 46832:47052, ack 37, win 501, options [nop,nop,TS val 1514891045 ecr 3611034978], length 220
11:56:36.186327 IP cybersecuritydroplet.ssh > 142.126.231.143.52141: Flags [P.], seq 47052:47272, ack 37, win 501, options [nop,nop,TS val 1514891045 ecr 3611034978], length 220
11:56:36.186416 IP cybersecuritydroplet.ssh > 142.126.231.143.52141: Flags [P.], seq 47272:47520, ack 37, win 501, options [nop,nop,TS val 1514891045 ecr 3611034978], length 248
11:56:36.186503 IP cybersecuritydroplet.ssh > 142.126.231.143.52141: Flags [P.], seq 47520:47740, ack 37, win 501, options [nop,nop,TS val 1514891045 ecr 3611034978], length 220
11:56:36.186593 IP cybersecuritydroplet.ssh > 142.126.231.143.52141: Flags [P.], seq 47740:47988, ack 37, win 501, options [nop,nop,TS val 1514891045 ecr 3611034978], length 248
11:56:36.186682 IP cybersecuritydroplet.ssh > 142.126.231.143.52141: Flags [P.], seq 47988:48208, ack 37, win 501, options [nop,nop,TS val 1514891045 ecr 3611034978], length 220
11:56:36.186770 IP cybersecuritydroplet.ssh > 142.126.231.143.52141: Flags [P.], seq 48208:48428, ack 37, win 501, options [nop,nop,TS val 1514891045 ecr 3611034978], length 220
11:56:36.186859 IP cybersecuritydroplet.ssh > 142.126.231.143.52141: Flags [P.], seq 48428:48676, ack 37, win 501, options [nop,nop,TS val 1514891045 ecr 3611034978], length 248
11:56:36.186946 IP cybersecuritydroplet.ssh > 142.126.231.143.52141: Flags [P.], seq 48676:48896, ack 37, win 501, options [nop,nop,TS val 1514891045 ecr 3611034978], length 220
11:56:36.187035 IP cybersecuritydroplet.ssh > 142.126.231.143.52141: Flags [P.], seq 48896:49116, ack 37, win 501, options [nop,nop,TS val 1514891046 ecr 3611034978], length 220
11:56:36.187123 IP cybersecuritydroplet.ssh > 142.126.231.143.52141: Flags [P.], seq 49116:49336, ack 37, win 501, options [nop,nop,TS val 1514891046 ecr 3611034978], length 220
11:56:36.187210 IP cybersecuritydroplet.ssh > 142.126.231.143.52141: Flags [P.], seq 49336:49584, ack 37, win 501, options [nop,nop,TS val 1514891046 ecr 3611034978], length 248
11:56:36.189775 IP 142.126.231.143.52141 > cybersecuritydroplet.ssh: Flags [.], ack 23096, win 5239, options [nop,nop,TS val 3611034985 ecr 1514891034], length 0
11:56:36.189820 IP cybersecuritydroplet.ssh > 142.126.231.143.52141: Flags [P.], seq 49584:49804, ack 37, win 501, options [nop,nop,TS val 1514891048 ecr 3611034985], length 220
11:56:36.189975 IP cybersecuritydroplet.ssh > 142.126.231.143.52141: Flags [P.], seq 49804:50036, ack 37, win 501, options [nop,nop,TS val 1514891049 ecr 3611034985], length 232
11:56:36.191044 IP 142.126.231.143.52141 > cybersecuritydroplet.ssh: Flags [.], ack 23292, win 5239, options [nop,nop,TS val 3611034985 ecr 1514891035], length 0
11:56:36.191081 IP cybersecuritydroplet.ssh > 142.126.231.143.52141: Flags [P.], seq 50036:50504, ack 37, win 501, options [nop,nop,TS val 1514891050 ecr 3611034985], length 468
11:56:36.191250 IP cybersecuritydroplet.ssh > 142.126.231.143.52141: Flags [P.], seq 50504:50736, ack 37, win 501, options [nop,nop,TS val 1514891050 ecr 3611034985], length 232
11:56:36.192539 IP 142.126.231.143.52141 > cybersecuritydroplet.ssh: Flags [.], ack 23292, win 5243, options [nop,nop,TS val 3611034987 ecr 1514891035,nop,nop,sack 1 {24020:24288}], length 0
11:56:36.192539 IP 142.126.231.143.52141 > cybersecuritydroplet.ssh: Flags [.], ack 24288, win 5227, options [nop,nop,TS val 3611034987 ecr 1514891035], length 0
11:56:36.192539 IP 142.126.231.143.52141 > cybersecuritydroplet.ssh: Flags [.], ack 24288, win 5227, options [nop,nop,TS val 3611034987 ecr 1514891035,nop,nop,sack 1 {24784:24996}], length 0
11:56:36.192539 IP 142.126.231.143.52141 > cybersecuritydroplet.ssh: Flags [.], ack 24996, win 5216, options [nop,nop,TS val 3611034987 ecr 1514891035], length 0
11:56:36.192539 IP 142.126.231.143.52141 > cybersecuritydroplet.ssh: Flags [.], ack 24996, win 5216, options [nop,nop,TS val 3611034987 ecr 1514891035,nop,nop,sack 1 {25280:25528}], length 0
11:56:36.192539 IP 142.126.231.143.52141 > cybersecuritydroplet.ssh: Flags [.], ack 25528, win 5234, options [nop,nop,TS val 3611034987 ecr 1514891035], length 0
11:56:36.192539 IP 142.126.231.143.52141 > cybersecuritydroplet.ssh: Flags [.], ack 25528, win 5234, options [nop,nop,TS val 3611034987 ecr 1514891035,nop,nop,sack 1 {25988:26256}], length 0
11:56:36.192540 IP 142.126.231.143.52141 > cybersecuritydroplet.ssh: Flags [.], ack 26256, win 5223, options [nop,nop,TS val 3611034987 ecr 1514891035], length 0
11:56:36.192580 IP cybersecuritydroplet.ssh > 142.126.231.143.52141: Flags [P.], seq 50736:51204, ack 37, win 501, options [nop,nop,TS val 1514891051 ecr 3611034987], length 468
11:56:36.192634 IP 142.126.231.143.52141 > cybersecuritydroplet.ssh: Flags [.], ack 26504, win 5219, options [nop,nop,TS val 3611034987 ecr 1514891035], length 0
11:56:36.192634 IP 142.126.231.143.52141 > cybersecuritydroplet.ssh: Flags [.], ack 26504, win 5219, options [nop,nop,TS val 3611034987 ecr 1514891035,nop,nop,sack 1 {26964:27212}], length 0
11:56:36.192634 IP 142.126.231.143.52141 > cybersecuritydroplet.ssh: Flags [.], ack 27212, win 5231, options [nop,nop,TS val 3611034987 ecr 1514891036], length 0
11:56:36.192634 IP 142.126.231.143.52141 > cybersecuritydroplet.ssh: Flags [.], ack 27460, win 5228, options [nop,nop,TS val 3611034987 ecr 1514891036], length 0
